Extracted contents:
header:          00 ff ff ff ff ff ff 00
serial number:   1e 6d 73 5b b6 8b 08 00 09 1e
version:         01 04
basic params:    a5 35 1e 78 9f
chroma info:     a4 35 a5 54 4f 9e 27 12 50 54
established:     a5 4b 80
standard:        31 7c 45 68 45 7c 61 7c 81 68 81 80 81 bc 95 3c
descriptor 1:    02 3a 80 18 71 38 2d 40 58 2c 45 00 13 2a 21 00 00 1e
descriptor 2:    5a 87 80 a0 70 38 4d 40 30 20 3a 00 13 2a 21 00 00 1a
descriptor 3:    00 00 00 fd 00 30 90 aa aa 24 01 0a 20 20 20 20 20 20
descriptor 4:    00 00 00 fc 00 4c 47 20 55 4c 54 52 41 47 45 41 52 0a
extensions:      01
checksum:        65

Manufacturer: GSM Model 5b73 Serial Number 560054
Made week 9 of 2020
EDID version: 1.4
Digital display
8 bits per primary color channel
DisplayPort interface
Maximum image size: 53 cm x 30 cm
Gamma: 2.20
DPMS levels: Standby
Supported color formats: RGB 4:4:4, YCrCb 4:4:4, YCrCb 4:2:2
Default (sRGB) color space is primary color space
First detailed timing is preferred timing
Supports GTF timings within operating range
Chroma Info:
Red X: 0.646484 Y: 0.330078
Green X: 0.309570 Y: 0.617188
Blue X: 0.152344 Y: 0.073242
White X: 0.313477 Y: 0.329102
Established timings supported:
  720x400@70Hz
  640x480@60Hz
  640x480@75Hz
  800x600@60Hz
  800x600@75Hz
  1024x768@60Hz
  1024x768@75Hz
  1280x1024@75Hz
  1152x870@75Hz
Standard timings supported:
  640x480@120Hz
  800x600@100Hz
  800x600@120Hz
  1024x768@120Hz
  1280x960@100Hz
  1280x1024@60Hz
  1280x1024@120Hz
  1440x900@120Hz
Detailed mode: Clock 148.500 MHz, 531 mm x 298 mm
               1920 2008 2052 2200 hborder 0
               1080 1084 1089 1125 vborder 0
               +hsync +vsync 
Detailed mode: Clock 346.500 MHz, 531 mm x 298 mm
               1920 1968 2000 2080 hborder 0
               1080 1083 1093 1157 vborder 0
               +hsync -vsync 
Monitor ranges (bare limits): 48-144Hz V, 170-170kHz H, max dotclock 360MHz
Monitor name: LG
Has 1 extension blocks
Checksum: 0x65 (valid)

CEA extension block
Extension version: 3
20 bytes of CEA data
  Audio data block
    Linear PCM, max channels 1
    Supported sample rates (kHz): 48 44.1 32
    Supported sample sizes (bits): 24 20 16
  Video data block
    VIC 01 640x480@60Hz 
    VIC 02 720x480@60Hz 
    VIC 03 720x480@60Hz 
    VIC 04 1280x720@60Hz 
    VIC 17 720x576@50Hz 
    VIC 18 720x576@50Hz 
    VIC 19 1280x720@50Hz 
    VIC 31 1920x1080@50Hz 
    VIC 16 1920x1080@60Hz (native)
    VIC 63 1920x1080@120Hz 
    VIC 64 1920x1080@100Hz 
  Speaker allocation data block
Underscans PC formats by default
Basic audio support
Supports YCbCr 4:4:4
Supports YCbCr 4:2:2
1 native detailed modes
Detailed mode: Clock 185.600 MHz, 531 mm x 298 mm
               1920 2008 2052 2200 hborder 0
               1080 1084 1089 1125 vborder 0
               +hsync +vsync 
Detailed mode: Clock 285.500 MHz, 531 mm x 298 mm
               1920 1968 2000 2080 hborder 0
               1080 1083 1088 1144 vborder 0
               +hsync +vsync 
Detailed mode: Clock 235.500 MHz, 531 mm x 298 mm
               1920 1968 2000 2080 hborder 0
               1080 1083 1088 1133 vborder 0
               -hsync -vsync 
Detailed mode: Clock 74.250 MHz, 531 mm x 298 mm
               1280 1390 1430 1650 hborder 0
                720  725  730  750 vborder 0
               +hsync +vsync 
Checksum: 0x88 (valid)

EDID block does NOT conform to EDID 1.3!
	Detailed block string not properly terminated
